{
  "$schema": "http://json-schema.org/draft-07/schema#",
  "$id": "chess-app/level.schema.json",
  "title": "Chess Level / Puzzle",
  "description": "Format for a single puzzle level. This schema only checks the shape of the file (right fields, right types). It cannot tell you whether startingFen is a legal position or whether solution is a legal sequence of moves — for that, run validate-levels.js, which replays the position through the actual chess engine.",
  "type": "object",
  "required": ["id", "title", "startingFen", "solution"],
  "additionalProperties": false,
  "properties": {
    "id": {
      "type": "string",
      "description": "Unique level identifier, e.g. \"level_1\". Should match the filename by convention."
    },
    "title": { "type": "string" },
    "description": {
      "type": "string",
      "description": "Optional flavor text or instructions shown to the player before they attempt the level."
    },
    "difficulty": {
      "type": "integer",
      "minimum": 1,
      "maximum": 10,
      "description": "Optional difficulty rating, 1 (easiest) to 10 (hardest)."
    },
    "hint": {
      "type": "string",
      "description": "Optional hint shown if the player asks for one."
    },
    "startingFen": {
      "type": "string",
      "description": "FEN of the puzzle's starting position. The side to move is taken from this FEN, not stated separately, so there is only one place that can go stale."
    },
    "solution": {
      "type": "array",
      "minItems": 1,
      "description": "The moves that solve the puzzle, in order, alternating sides starting from whichever side startingFen says is to move.",
      "items": {
        "type": "object",
        "required": ["from", "to"],
        "additionalProperties": false,
        "properties": {
          "from": { "type": "string", "pattern": "^[a-h][1-8]$" },
          "to": { "type": "string", "pattern": "^[a-h][1-8]$" },
          "promotion": {
            "type": ["string", "null"],
            "enum": ["Q", "R", "B", "N", null],
            "description": "Set only when this step is a pawn promotion."
          }
        }
      }
    }
  }
}
