{
  "id": "level_3",
  "title": "Mat en 1 — Dame",
  "description": "Les blancs jouent et matent en un coup avec la dame.",
  "difficulty": 2,
  "hint": "La dame peut se placer sur la colonne g pour donner un échec et mat.",
  "startingFen": "5rk1/5ppp/8/8/8/8/1Q6/4K3 w - - 0 1",
  "solution": [
    { "from": "b2", "to": "g7", "promotion": null }
  ]
}
