{
  "id": "level_1",
  "title": "Mat en 1",
  "description": "Les blancs jouent et matent en un coup.",
  "difficulty": 1,
  "hint": "La dame peut capturer un pion en donnant échec et mat en même temps.",
  "startingFen": "r1bqkb1r/pppp1ppp/2n2n2/4p2Q/2B1P3/8/PPPP1PPP/RNB1K1NR w KQkq - 4 4",
  "solution": [
    { "from": "h5", "to": "f7", "promotion": null }
  ]
}
